profession-capability-framework-capability-mastery-level	profession-capability-framework-capability	profession-capability-framework-mastery-level	description	start-date	end-date
10132	1001	15	(None specified)		
10056	1002	11	Able to identify and compare the best processes or delivery methods to use. Able to recognise when something does not work and encourages a mindset of experimentation. Can adapt and reflect, is resilient and has the ability to see outside of the process. Able to use a blended approach depending on the context. Able to measure and evaluate outcomes. Able to help teams to manage and visualise outcomes.		
10043	1002	12	Coaches and leads teams in Agile and Lean practices. Is a recognised expert that advocates these approaches, continuously reflecting and challenging the team. Creates or tailors new ways of working and is always innovating.		
10064	1002	13	Has had experience in applying Agile principles in practice. Able to provide a clear, open and transparent framework in which teams can deliver. Has an awareness of Agile tools and is starting to use them intelligently. Able to visualise and make visible the work of the team.		
10001	1003	11	Able to identify and compare the best processes or delivery methods to use, including measuring and evaluating outcomes. Helps the team to decide the best approach. Able to help teams to manage and visualise outcomes, prioritise work and work to agreed minimum viable product (MVP), print and scope.		
10074	1003	12	Coaches and leads teams in Agile and Lean practices, determining the right approach for the team to take and evaluating this through the life of a project. Is able to think of new and innovative ways of working to achieve the right outcomes. Is able to act as a recognised expert and advocates for the approaches, continuously reflecting and challenging the team.		
10456	1003	12	Coaches and leads teams in Agile and Lean practices, determining the right approach for the team to take and evaluating this through the life of a project. Is able to think of new and innovative ways of working to achieve the right outcomes. Is able to act as a recognised expert and advocates for the approaches, continuously reflecting and challenging the team		
10501	1003	12	Coaches and leads teams in agile and Lean practices, determining the right approach for the team to take and evaluating this through the life of a project. Is able to think of new and innovative ways of working to achieve the right outcomes. Is able to act as a recognised expert and advocates for the approaches, continuously reflecting and challenging the team.		
10030	1003	13	Has had experience in working in agile, including an awareness of agile tools and how to use them. Can advise colleagues on how and why agile methods are used and is able to provide a clear, open and transparent framework in which teams can deliver. Can adapt and reflect, is resilient and has the ability to see outside of the process.		
10100	1003	14	Has an awareness of Agile methodology and the ways you could apply the principles in practice. Able to take an open-minded approach and understands why iteration is important and can do it quickly.		
10489	1003	14	Has an awareness of agile methodology and the ways you could apply the principles in practice. Able to take an open-minded approach and understands why iteration is important, and can do it quickly.		
10498	1003	14	Has an awareness of agile methodology and the ways you could apply the principles in practice. Able to take an open-minded approach and understands why iteration is important and can do it quickly.		
10507	1003	14	Has an awareness of agile methodology and the ways you could apply the principles in practice. Able to take an open-minded approach, understands why iteration is important and can do it quickly.		
10190	1004	11	Monitors the analysis of a technical solution and ensures analysis is re-used for similar problem sets. Reviews solutions and identifies areas for change. Drives the collection of information that is used and analysed. Feeds back on policy and requirements.		
10185	1004	12	Provides direction and leads on change with regards to factors that feed into analysis. Monitors changes in the technical environment and assesses whether risks are still at acceptable levels or whether previous decisions need to be revisited. Directs and influences others on best practice and policy.		
10196	1004	13	Able to apply the approach to real problems and consider all relevant information. Applies appropriate rigour to ensure a full solution is designed and achieves the business outcome.		
10519	1005	11	Understands and can help teams apply a range of methods to analyse research data and synthesise findings. Knows how to engage sceptical colleagues in analysis and synthesis. Can advise on choice and application of techniques, and can critique colleagues’ findings to assure best practice.		
10509	1005	12	Can help an organisation adopt a wide range of analysis and synthesis techniques. Can help an organisation to continually assure, improve and innovate their practices to generate clear and valuable findings.		
10524	1005	13	Understands how to apply basic techniques for analysis of research data and synthesis of findings. Knows how to involve their team in analysis and synthesis. Can present clear findings that colleagues can understand and use.		
10533	1005	14	Is aware of the need for careful analysis of research data to produce clear findings.		
10410	1006	11	Understands and can help teams apply a range of practices. Develops deeper expertise on a narrower range of specialisms. Starts to apply emerging theory to practical situations.		
10411	1006	13	Has broad knowledge of how and when to practically apply existing best practice solutions.		
10417	1006	14	Understands the theoretical basis for applied practices and is beginning to be able to apply the theory to practical examples.		
10294	1007	11	Manages configuration items, related information, service compliance and risks.		
10334	1007	12	Manages configuration management for the organisation, ensuring value for the business and adherence to company policies. Ensures changes to assets are recorded and controlled appropriately. Promotes organisational commitment to asset control.		
10302	1007	13	Maintains secure configuration and accurate information, controlling IT assets in one or more significant areas and verifying location and state of assets.		
10314	1007	13	Maintains secure configuration and accurate information, controlling IT assets in one or more significant areas, and verifying location and state of assets.		
10275	1007	14	Tracks, logs and corrects information to protect assets and components.		
10211	1008	11	Ensures the correct implementation of standards and procedures, identifying capacity issues, stipulating the required changes and instigating these. Instigates remedial action.		
10295	1008	11	Ensures the correct implementation of standards and procedures. Proactively reviews information in conjunction with service level agreements to identify any availability and capacity issues and specifies any required changes (SFIA 6, Level 5, CPMG). Instigates remedial activities.		
10239	1008	12	Drives policy and strategy for service and capacity management, and the implementation of required changes.		
10203	1008	13	Manages the service components to ensure they meet business needs and performance targets.		
10227	1008	14	Aware of availability and capacity management processes.		
10120	1009	11	Able to listen to the needs of the technical and business stakeholders and interpret between them. Capable of proactive and reactive communication.		
10110	1009	12	Able to mediate and mend relationships, communicating with stakeholders at all levels.		
10125	1009	13	Able to speak on behalf of technical teams and facilitate the relationships with indirect stakeholders.		
10276	1010	11	Has a deep understanding of the technical concepts required in their role and understands how these fit into the wider technical landscape.		
10348	1010	12	Not Applicable		
10287	1010	13	Understands core technical concepts related to their role and is able to apply them with guidance.		
10303	1010	14	Aware of the subject matter and has an understanding of what it involves.		
10352	1010	14	Aware of availability and capacity management processes.		
10139	1011	11	Has a deep understanding of the technical concepts required in their role and understands how these fit into the wider technical landscape.		
10133	1011	12	Able to predict and advise on future technology changes that present opportunities for a product or programme.		
10143	1011	14	Aware of the subject matter and has an understanding of what it involves.		
10434	1012	11	Has a deep understanding of the technical concepts required in their role and understands how these fit into the wider technical landscape. Understands the limitations of digital technology.		
10424	1012	12	Exploits opportunities through the recognition of new digital technologies to enhance analytical capability in alignment with business goals.		
10441	1012	13	Understands core technical concepts related to their role and is able to apply them.		
10448	1012	14	Aware of some analytical tools and technologies and is able to use them. Is aware of digital technology and has an understanding of what it involves and its impact.		
10002	1013	11	Responsible for investigative work into problems and opportunities in existing and new services. Drives the analysis and collection of information and creation of to create recommendations for service improvements. Analyses large amounts of complex information and uses it to produce solutions.		
10020	1013	13	Investigates problems and analyses options for new and existing services. Provides recommendations to solutions. Works with stakeholders to identify objectives, opportunities and potential benefits available.		
10031	1013	14	Investigates operational needs or problems and assists in the recommendation of service improvement and business solutions. Contributes to the recommendation of improving services and understands the importance of evidence-based design or analysis.		
10278	1014	11	Leads investigative work into problems and opportunities in existing processes, driving the collection of information and creation of recommendations for improvements. Can absorb large amounts of conflicting information and use it to produce solutions.		
10269	1014	12	Directs business analysis, including the collection of information and evidence, identification of problems and opportunities, and ensuring recommendations fit with strategic business objectives. Communicates recommendations persuasively to key stakeholders and can identify the simplest approach out of a variety of approaches.		
10284	1014	13	Investigates problems and opportunities in existing processes and contributes to recommending solutions to these. Works with stakeholders to identify objectives and potential benefits available.		
10337	1014	14	Contributes to the recommendation of improving processes and understands the importance of evidence-based design or analysis.		
10003	1015	11	Able to analyse current services and processes, and identify and implement opportunities to optimise these. Helps to evaluate and establish requirements using relevant techniques such as gap analysis.		
10032	1015	13	Able to identify service and process improvement opportunities with guidance. Contributes to the implementation of proposed solutions.		
10017	1016	11	Models more advanced and complex situations across more than one business function or programme. Gathers insight from senior stakeholders and communicates modelling results clearly to them.		
10009	1016	12	Is an advisor on the most appropriate techniques to use and creates models that support a business strategy. Plans and coordinates the team’s modelling and supports them in this.		
10025	1016	13	Can use a wide range of techniques to model situations confidently. Gains the necessary agreement needed from subject matter experts and stakeholders, ensuring they review the results to fix any issues.		
10038	1016	14	Models simple areas using established techniques and understands the purpose of this and its importance. Can assist in complex modelling if required.		
10018	1017	11	Takes responsibility for creation of test cases. Creates traceability records, from test cases back to requirements.		
10010	1017	12	Accountable for integrity of testing and acceptance activities, and coordinates the execution of these activities. Manages client relationships with respect to testing matters.		
10026	1017	13	Reports on system quality and collects metrics on test cases.		
10039	1017	14	Supports business process testing. Executes test cases under supervision. Understands the role of business process testing and how it works.		
10288	1018	11	Deals with high impact, complex change requests. Ensures that release policies, procedures and processes are applied.		
10354	1018	12	Has broad industry experience in change management and is able to implement a successful change management process from zero to full maturity. A champion of change management, actively improving and optimising current processes.		
10309	1018	13	Able to analyse and assess impact, develops and documents change requests. Implements changes based on requests for change.		
10296	1018	14	Able to implement changes based on requests for change. Applies change control procedures.		
10250	1019	13	Able to interact, read code, write HTML and is able to carry out baseline repair activities.		
10258	1019	14	Has an understanding of how the internet works and is aware of which tools and software are available to be utilised and are currently in practice.		
10327	1020	13	Interacts with and reads code and is able to carry out baseline repair activities.		
10329	1020	13	Interacts with and reads code, and is able to carry out baseline repair activities.		
10330	1020	14	Knows which scripting tools and software are available to be utilised and are currently in practice.		
10053	1021	11	Able to take responsibility for complex relationships with contracted suppliers. Able to identify appropriate contractual frameworks. Able to identify appropriate suppliers. Able to negotiate with contracted suppliers. Able to get good value out of contracts and suppliers.		
10049	1021	12	Able to act as the escalation point and resolve large or high risk commercial management issues. Able to coach others in appropriate commercial management.		
10061	1021	13	Able to act as the point of contact for contracted suppliers. Understands appropriate internal contacts and processes within a government department. Understands how and when third parties should be brought into DDaT projects.		
10435	1022	11	Turns complex data into compelling, clear and actionable stories. Shares data communication skills with the team and across government. Presents analysis and visualisations in clear ways to communicate complex messages. Is able to communicate negative and positive information to stakeholders. Able to give tactical and strategic recommendations.		
10425	1022	12	Able to communicate relevant, compelling stories using the most appropriate medium. Able to give complex recommendations at a tactical and strategic level. Presents analysis and visualisations in clear ways to communicate complex messages. Is able to communicate negative and positive information to stakeholders.		
10442	1022	13	Understands the appropriate media to communicate findings. Shapes and shares communications cognisant of the audience. Able to give tactical recommendations.		
10187	1023	11	Has a deep understanding and is able to apply security concepts to a technical level. Able to effectively translate and accurately communicate security and risk implications across technical and non-technical stakeholders, and able to respond to challenge. Able to manage stakeholders’ expectations and be flexible, adapting to stakeholders’ reactions to reach consensus.		
10180	1023	12	Has an expert understanding and is able to apply security concepts to a technical level, at the highest levels of risk complexity. Able to effectively translate and accurately communicate security and risk implications at the most senior levels across technical and non-technical stakeholders, and able to respond to challenge. Able to manage stakeholders’ expectations across high-risk and complexity or under constrained timescales.		
10160	1024	11	Able to listen to the needs of technical and business stakeholders and interpret between them. Able to manage stakeholders’ expectations and be flexible, is capable of proactive and reactive communication. Facilitates difficult discussions within the team or with diverse senior stakeholders.		
10149	1024	12	Able to mediate and mend relationships, communicating with stakeholders at all levels. Able to manage stakeholders’ expectations and facilitate discussions across high risk or complex topics or under constrained timescales. Able to speak and represent the community to large audiences inside and outside of government.		
10376	1024	12	Able to mediate and mend relationships, communicating with stakeholders at all levels. Able to manage stakeholders’ expectations and facilitate discussions across high risk or complex topics, or under constrained timescales. Able to speak and represent the community to large audiences inside and outside of government.		
10170	1024	13	Able to effectively translate and accurately communicate across technical and non-technical stakeholders as well as facilitating discussions within a multidisciplinary team, with potentially difficult dynamics. Able to advocate for the team externally and can manage differing perspectives.		
10390	1024	14	Is aware of the need to translate technical concepts into non-technical language and understands what communication is required to internal and external stakeholders.		
10473	1025	11	Able to listen to the needs of the technical and business stakeholders and interpret between them. Able to manage stakeholders’ expectations and be flexible, is capable of proactive and reactive communication. Facilitates difficult discussions within the team or with diverse senior stakeholders.		
10477	1025	11	Able to listen to the needs of the technical and business stakeholders and interpret them. Able to manage stakeholders’ expectations and be flexible, is capable of proactive and reactive communication. Facilitates difficult discussions within the team or with diverse senior stakeholders.		
10502	1025	11	Able to listen to the needs of the technical and business stakeholders, and interpret between them. Able to manage stakeholders’ expectations and be flexible, is capable of proactive and reactive communication. Facilitates difficult discussions within the team or with diverse senior stakeholders.		
10464	1025	12	Able to mediate and mend relationships, communicating with stakeholders at all levels. Able to manage stakeholders’ expectations and facilitate discussions across high risk and complexity or under constrained timescales. Able to speak / represent the community to large audiences inside and outside of government.		
10470	1025	12	Able to mediate and mend relationships, communicating with stakeholders at all levels. Able to manage stakeholders’ expectations and facilitate discussions across high risk and complexity or under constrained timescales. Able to speak and represent the community to large audiences inside and outside of government.		
10496	1025	12	Able to mediate and mend relationships, communicating with stakeholders at all levels. Able to manage stakeholders’ expectations and facilitate discussions across high risk and complexity or under constrained timescales. able to speak and represent the community to large audiences inside and outside of government.		
10483	1025	13	Able to effectively translate and accurately communicate across technical and non-technical stakeholders as well as facilitate discussions within a multidisciplinary team, with potentially difficult dynamics. Able to advocate for the team externally and can manage differing perspectives.		
10490	1025	14	Aware of the need to translate technical concepts into non-technical language and understands what communication is required to internal and external stakeholders.		
10345	1026	11	Able to work collaboratively within a group, actively networking with others and engaging in varying types of feedback choosing the appropriate time and ensuring the discussion sticks. Uses initiative to identify problems or issues in the team dynamic and rectify them. Able to pull out issues through agile health-checks with the team to provoke the right responses.		
10356	1026	11	Able to work collaboratively within a group, actively networking with others and engaging in varying types of feedback choosing the appropriate time, and ensuring the discussion sticks. Uses initiative to identify problems or issues in the team dynamic and rectify them. Able to pull out issues through agile health-checks with the team to provoke the right responses.		
10072	1026	12	Able to solve and unblock issues between teams or departments at the highest level. Understands the psychology of the team and has strong mediation skills. Able to coach the organisation on team dynamics and conflict resolution whilst also building and growing the community.		
10341	1026	13	Contributes to the work of others whilst having the ability to motivate and empower teams. Creates the right environment for teams to work in and is able to facilitate the best team makeup depending on the situation. Recognises and deals with issues.		
10357	1026	14	Understands the work of others and the importance of team dynamics, collaboration and feedback.		
10277	1027	11	Able to analyse current processes, identify and implement opportunities to optimise processes and leads and develops a team of experts to deliver service improvements. Helps to evaluate and establish requirements for the implementation of changes by setting policy and standards.		
10283	1027	13	Able to identify process optimisation opportunities with guidance and contribute to the implementation of proposed solutions.		
10304	1027	14	Aware of the importance to consider developing process efficiency and common ways in which processes are optimised. Supports specific activities to improve development processes. Able to spot or identify obvious deficiencies.		
10340	1027	14	Able to identify process optimisation opportunities with guidance and contribute to the implementation of proposed solutions.		
10346	1028	13	Manages the runbooks for service continuity. This includes managing the processes around service continuity and testing the runbooks to ensure that service availability can be maintained in any event.		
10344	1028	14	Aware of the IT standard continuity management processes and procedures.		
10351	1029	11	Maintains a high level of customer service. Has the confidence to deal with complex complaints and uses empathy to satisfy customer demands.		
10349	1029	12	Translates ‘lessons learnt’ from complaint cycles into continual service improvement. Takes responsibility for the full range of customer service functions including reviewing customer service satisfaction. Investigates which processes can be automated and ways to do so.		
10353	1029	13	Resolves user requests to a minimum of the agreed service level agreement. Able to empathise with the end user. Uses customer-focused metrics to achieve a satisfying outcome.		
10377	1030	11	Understands and can help teams apply a range of techniques for data profiling and source system analysis from a complex single source. Able to bring multiple data sources together in a conformed model for analysis.		
10154	1030	13	Undertakes data profiling and source system analysis and can present clear insights to colleagues to support the end use of the data.		
10155	1031	11	Turns complex data into clear, simple and actionable stories. Shares data communication skills with the team and across government.		
10165	1031	13	Understands the appropriate mediums to communicate findings and shapes communications to the audience.		
10175	1031	14	Aware that data needs to be aligned to the needs of the end user. Able to create basic visuals and presentations.		
10386	1032	11	Designs, builds and tests data products that are complex or large scale. Builds teams to complete data integration services.		
10378	1032	12	Establishes enterprise-scale data integration procedures across the data development lifecycle and ensures that teams adhere to these. Manages resources to ensure that data services work effectively at an enterprise level.		
10391	1032	13	Designs, builds and tests data products based on feeds from multiple systems using a range of different storage technologies and/or access methods. Creates repeatable and reusable products.		
10397	1033	11	Can work with data engineers to map, produce, transform and test new data feeds for data owners and consumers, selecting the most appropriate tools and technologies. Can lead ad hoc data exploration in a wide variety of data serialisation and storage formats, from across the business, for data consumers.		
10404	1033	12	Has significant experience building data pipelines at scale using a range of tools and technologies and can advise on data engineering best practices across industry. Can lead ad hoc data exploration practices in their business area by identifying and setting best practice and standards. Identifies opportunities for future innovation of data exploration practices.		
