profession-capability-framework-capability-mastery-level	profession-capability-framework-capability	profession-capability-framework-mastery-level	description	start-date	end-date
10281	1097	13	Able to work within a strategic context and communicate how activities meet strategic goals. Contributes to the development of strategy and policies.		
10462	1097	14	Aware of the strategic context of their work and why it is important. Supports strategic planning in an administrative capacity.		
10499	1097	15	N/A		
10159	1098	12	Leads the design and implementation of strategy, directing the evaluation of strategies and policies to ensure business requirements are being met.		
10169	1098	13	Works within a strategic context and communicates how activities meet strategic goals.		
10179	1098	14	Aware of the strategic context of their work and why it is important. Supports strategic planning in an administrative capacity.		
10119	1099	11	Capable of defining and challenging strategies, patterns, standards, policies, roadmaps and vision statements. Capable of providing proactive advice and guidance for their definition across the organisation.		
10115	1099	12	Capable of shaping and influencing government strategy. Able to own and be responsible for setting strategies, patterns, standards, policies, roadmaps and vision statements.		
10124	1099	13	Capable of applying strategy, using patterns, standards, policies, roadmaps and vision statements. Able to challenge them and provide guidance.		
10131	1099	14	Aware of the purpose and application of strategy, standards, patterns, policies, roadmaps and vision statements.		
10136	1100	11	Architects the design of network services within a team requiring moderate to complex service integration.		
10146	1100	14	Familiar with the principles of integration and how these should be incorporated within the design of solutions.		
10142	1101	11	Designs systems characterised by medium levels of risk, impact and business or technical complexity. Selects appropriate design standards, methods and tools  and ensures they are applied effectively. Reviews the systems designs of others to ensure selection of appropriate technology, efficient use of resources and integration of multiple systems and technology.		
10216	1101	11	Designs systems characterised by medium levels of risk, impact and business or technical complexity. Selects appropriate design standards, methods and tools and ensures they are applied effectively. Reviews the systems designs of others to ensure selection of appropriate technology, efficient use of resources, and integration of multiple systems and technology.		
10235	1101	11	Designs systems characterised by medium levels of risk, impact and business or technical complexity. Selects appropriate design standards, methods and tools and ensures they are applied effectively. Reviews the systems designs of others to ensure selection of appropriate technology, efficient use of resources and integration of multiple systems and technology.		
10137	1101	12	Designs systems characterised by high levels of risk, impact and business or technical complexity. Controls system design practice within an enterprise or industry architecture. Influences industry based models for the development of new technology applications. Develops effective implementation and procurement strategies, consistent with business needs. Ensures adherence to relevant technical strategies, policies, standards and practices.		
10147	1101	13	Translates logical designs into physical designs. Produces detailed designs and documents all work using required standards, methods and tools, including prototyping tools where appropriate. Designs systems characterised by managed levels of risk, manageable business and technical complexity and meaningful impact. Works with well-understood technology and identifies appropriate patterns.		
10220	1101	13	Translates logical designs into physical designs. Produces  detailed designs and documents all work using required  standards, methods and tools, including prototyping tools where  appropriate. Designs systems characterised by managed levels of risk, manageable business and technical complexity and meaningful impact. Works with well-understood technology and identifies appropriate patterns.		
10225	1101	14	Assists as part of a team on design of components of larger systems.		
10202	1102	11	Defines the integration build. Able to coordinate build activities across systems and understands how to undertake and support integration testing activities.		
10209	1102	11	Defines the integration build. Able to coordinate build activities across systems, and understands how to undertake and support integration testing activities.		
10238	1102	11	Defines the integration build. Able to co-ordinate build activities across systems and understands how to undertake and support integration testing activities.		
10236	1102	12	Establishes standards and procedures across a service lifecycle including the development lifecycle and ensures that practitioners adhere to this. Manages resources to ensure that the systems integration function works effectively.		
10221	1102	13	Able to build and test simple interfaces between systems, or can work on more complex integration as part of a wider team.		
10226	1102	14	Aware of how to integrate systems and the challenges of designing, building and testing interfaces between systems.		
10052	1103	11	Able to identify problems or issues in the team dynamic and rectify them. Able to pull out issues through Agile health-checks with the team and provoke the right responses. Able to engage in varying types of feedback choosing the right type at the appropriate time and ensuring the discussion and decision sticks. Able to accelerate the team development cycle.		
10048	1103	12	Changes organisational structures to fixable, sustainable, good designs. Leads on the strategy for the whole organisation, joining up business needs with innovative analysis. Able to make and justify decisions characterised by high levels of risk, impact and complexity. Builds consensus between organisations (private or public) or highly independent and diverse stakeholders. Solves and unblocks issues between teams or departments at the highest level. Understands the psychology of the team and has strong mediation skills. Able to coach the organisation on team dynamics and conflict resolution.		
10060	1103	13	Able to bring people together to form a motivated team. Able to empower delivery teams. Able to help create the right environment for a team to work in. Recognises and deals with issues. Able to facilitate the best team makeup depending on the situation.		
10069	1103	14	Has an awareness of the importance of team dynamics, collaboration and empowering delivery teams. Understands the importance of feedback.		
10361	1104	11	Has a good working knowledge of different tools and techniques and can train others. Able to advise others on testing techniques and frameworks. Able to research, plan and train others within the team.		
10373	1104	12	Able to act as an advisor with a strategic understanding of IT trends and technologies. Able to write and publish papers. Is knowledgeable of emerging tools and techniques. Can set up frameworks based on the needs of the team. Able to work across different tools and software languages.		
10366	1104	13	Able to use a range of technologies for testing. Able to use one type of tool to write test scripts. May use technologies to design and execute test cases under guidance.		
10369	1104	14	Aware of a range of tools and techniques for test automation. Likely to have some demonstrable technical attributes.		
10306	1105	11	Able to draft and maintain procedures and documentation. Able to set standards for definition, security and integrity of objects and ensures conformance to these standards.		
10291	1105	12	Understands the direction for future technologies. Delivers a model to support and maintain those future technologies and any databases that co-exist in the current environment.		
10311	1105	13	Able to use management system software and tools. Has knowledge of logical schemata to investigate problems, collect performance statistics and create reports. Able to carry out routine configuration, installation and reconfiguration of database and related products. Optimises performance and forecasts resource needs.		
10299	1105	14	Assists in technical support activities. Carries out agreed / routine maintenance and administration tasks.		
10324	1105	14	Assists in technical support activities. Carries out agreed and routine maintenance and administration tasks.		
10256	1106	11	Has deep understanding of the technical concepts required in their role and understands how these fit into the wider technical landscape.		
10514	1106	11	Has knowledge of the technologies used to build and operate digital services. Can collaborate closely with colleagues in different digital disciplines.		
10247	1106	12	Able to anticipate and advise on future technology changes that present opportunities for the product or programme.		
10261	1106	13	Understands core technical concepts related to their role and is able to apply them with guidance.		
10527	1106	13	Has some knowledge of current technologies used to build and operate digital services. Understands the different technical roles in a digital team.		
10266	1106	14	Aware of the subject matter and has a high level understanding of what it involves.		
10532	1106	14	Has some knowledge of the technologies and roles within a digital team.		
10384	1107	11	Has a deep understanding of the technical concepts required in their role, and understands how these fit into the wider technical landscape.		
10381	1107	12	Able to predict and advise on future technology changes that present opportunities for the product or programme.		
10388	1107	13	Understands core technical concepts related to their role and is able to apply them with guidance.		
10359	1108	11	Able to think outside the box, ask the right questions and critically evaluate and communicate findings to a larger team. Leads investigative work into problems and opportunities in existing processes, driving the collection of information and creation of recommendations for improvements. Can absorb large amounts of conflicting information and use it to determine solutions.		
10374	1108	11	Able to think outside the box, ask the right questions, and can critically evaluate and communicate findings to a larger team. Leads investigative work into problems and opportunities in existing processes, driving the collection of information and creation of recommendations for improvements. Can absorb large amounts of conflicting information and use it to determine solutions.		
10363	1108	12	Able to analyse and collect of information and evidence, identify  problems and opportunities and ensure recommendations fit with strategic business objectives. Able to communicate recommendations persuasively to key stakeholders and identify the simplest approach from a variety of approaches. Able to solve complex problems applying logical reasoning.		
10368	1108	13	Able to identify simple patterns and trends. Investigates problems and opportunities in existing processes and contributes to recommending solutions to these. Works with stakeholders to identify objectives and potential benefits available.		
10371	1108	14	Contributes to improving delivery and understands the importance of evidence-based design and analysis.		
10248	1109	11	Manages planning of system and/or acceptance tests, coordinating both functional and non-functional specifications. Able to provide authoritative advice and guidance on test planning, can identify process improvements and contribute to the definition of best practice.		
10307	1109	11	Manages planning of system and / or acceptance tests, coordinating both functional and non-functional specifications. Able to provide authoritative advice and guidance on test planning and can identify the process improvements and contribute to definition of best practice.		
10318	1109	11	Manages planning of system or acceptance tests, coordinating both functional and non-functional specifications. Able to provide authoritative advice and guidance on test planning and can identify the process improvements and contribute to definition of best practice.		
10292	1109	12	Holds responsibility for managing testing activities within development or integration activities. Manages risks and can take preventative action when risks become unacceptable. Manages customer relations.		
10257	1109	13	Able to review requirements, specifications and define test conditions. Able to identify issues and risks associated with work whilst being able to analyse and report test activities and results.		
10312	1109	13	Able to review requirements, specifications and defines test conditions. Able to identify issues and risks associated with work whilst being able to analyse and report test activities and results.		
10262	1109	14	Correctly executes test scripts under supervision. Understands the role of testing and how it works.		
10013	1110	11	Able to define test condition requirements. Works according to test plans to design, interpret and execute them. Highlights reports and risks and is able to analyse results based on tests and activities.		
10029	1110	13	Able to review requirements, specifications and define test conditions. Able to identify issues and risks associated with work whilst being able to analyse and report test activities and results.		
10042	1110	14	Executes test scripts under supervision. Understands the role of testing and how it works in systems development.		
10469	1111	11	Proficient, fast and fluid in the use of software. Knows shortcuts and tricks as well as what not to do. Is responsible for choosing the technology and outputs, for example, paper size, weight.		
10480	1111	11	Proficient, fast and fluid in the use of software. Knows shortcuts and tricks as well as what not to do. Is responsible for choosing the technology and outputs, for example paper size, weight.		
10475	1111	12	Able to create tools for other designers to use and can teach others. Works with tools that have an impact on other designers.		
10494	1111	13	Able to use the most appropriate tools and software for a particular job.		
10138	1112	11	Able to dissect a problem to its component parts to identify and diagnose root causes. Able to troubleshoot and identify problems across different technology capabilities.		
10249	1112	12	Has lateral thinking capability to dissect a problem to its component parts to identify and diagnose root causes. Able to troubleshoot and identify problems across different technology capabilities including compute, storage, networking, physical infrastructure, software, commercial off the shelf (COTS) and open source.		
10148	1112	13	Able to troubleshoot and identify problems across different technology capabilities.		
10267	1112	14	Aware of different technology capabilities with basic troubleshooting capability.		
10164	1113	11	Designs data architecture by dealing with problems that span different business areas. Draws links between problems in order to reach common solutions. Works across multiple subject areas, a single large or complicated subject area.		
10153	1113	12	Designs data architecture by dealing with problems that span the enterprise. Works across all organisational subject areas.		
10174	1113	13	Designs data architecture by dealing with specific business problems and aligning it to enterprise-wide standards and principles. Works within the context of well understood architecture and identifies appropriate patterns.		
10122	1114	11	Designs systems characterised by medium levels of risk, impact and business or technical complexity. Works across multiple services or a single large or complicated service.		
10112	1114	12	Designs systems characterised by high levels of risk, impact and business or technical complexity.		
10126	1114	13	Designs systems characterised by managed levels of risk, manageable business and technical complexity and meaningful impact. Works with well-understood technology and identifies appropriate patterns.		
10438	1115	11	Able to apply experience of multiple parts of the lifecycle. Able to recognise when to move forward and when to stop. Able to recognise the appropriate deliverables and engage the right people to meet these. Able to work with other Agile delivery disciplines throughout the product life cycle. Able to plan and proactively engage with stakeholders at the appropriate stage of the project. Able to identify which tools and techniques should be used at each stage.		
10429	1115	12	Able to develop sustainable support models. Able to identify and deal with potential risks across or between all phases of the lifecycle. Able to coach others. Able to contribute to the assessment of other teams, providing guidance and support as they move through the life cycle phases. Leads and champions best practice and identifies improvements to current approaches.		
10433	1115	12	Able to develop sustainable support models. Able to identify and deal with potential risks across or between all phases of the lifecycle. Able to coach others. Able to contribute to the assessment of other teams, providing guidance and support as they move through the life cycle phases. Leads and champions best practice, and identifies improvements to current approaches.		
10445	1115	13	Understands how the needs of the team and product vary across the lifecycle. Ensures the team is measuring performance as appropriate for the relevant service standard phase. Able to manage the delivery of services or products at different phases. Plans ahead and looks at data requirements in future phases.		
10452	1115	14	Describes the importance of performance measures, their relation to business objectives and how they vary at different stages of the lifecycle.		
10402	1116	11	Understands and can help teams apply a range of techniques to analyse data and provide insight. Is proactive and can present compelling findings that inform wider decisions. Starts to apply innovative approaches to resolve problems.		
10409	1116	12	Understands, teaches and supervises a wide range of analysis techniques. Can help organisations create and learn from strategic insights. Able to apply innovative approaches to resolve problems.		
10416	1116	13	Understands and can work with colleagues to apply core techniques for analysis and provide insight. Presents clear insights that colleagues can understand and use.		
10423	1116	14	Is aware of the need for careful analysis of data to produce clear insights.		
10092	1117	11	Works with and challenges senior stakeholders. Can prioritise and mitigate constraints, and can turn them into an advantage. Is able to adapt the approach depending on the constraints.		
10472	1117	11	Works with and challenges senior stakeholders. Can prioritise and mitigate constraints and can turn them into an advantage. Is able to adapt the approach depending on the constraints.		
10088	1117	12	Able to influence, challenge and coach. Able to anticipate how constraints might change and knows where to challenge or remove constraints.		
10099	1117	13	Can identify and understand constraints, and is able to communicate these and work within them. Is able to challenge the validity of constraints. Capable of ensuring standards are being met.		
10476	1117	13	Can identify and understand constraints and is able to communicate these and work within them. Is able to challenge the validity of constraints. Capable of ensuring standards are being met.		
10109	1117	14	Understands the value of policy, legislative, regulatory and operational constraints and finds the least troublesome solution for users.		
10487	1117	14	Understands the value of policy, legislative, regulatory and operational constraints and finds the simplest, shortest and fastest solution for users.		
10495	1117	15	N/A		
10439	1118	11	Works with and challenges senior stakeholders. Can prioritise and mitigate constraints and can turn them into an advantage. Is able to adapt the approach according to constraints. Has a good knowledge of security and data privacy.		
10430	1118	12	Able to influence, challenge and coach. Able to anticipate how constraints might change and knows where to challenge or remove constraints. Has a very strong knowledge of security and data privacy. Describes and works within environmental constraints, finding the most appropriate solution for users.		
10446	1118	13	Can identify and understand constraints, and is able to communicate these and work within them. Is able to challenge the validity of constraints. Capable of ensuring standards are being met. Has an understanding of security and data privacy.		
10453	1118	14	Has an awareness of ethical and operational constraints.		
10293	1119	11	Has expert certificate in Service Management Framework qualification.		
10316	1119	11	Has expert certificate in service management framework qualification.		
10325	1119	11	Has Expert Certificate in Service Management Framework qualification.		
10347	1119	11	Has Expert Certificate in Service Management Framework Qualification.		
10333	1119	12	Has Expert Certificate in Service Management Framework qualification and an industry understanding of how to implement the framework into numerous environments.		
10273	1119	13	Has a level 3 service management framework qualification and knowledge of lifecycle or capability elements of ITIL.		
10308	1119	13	Has a Level 3 Service Management Framework Qualification and knowledge of lifecycle and, or,  capability elements of ITIL.		
10319	1119	13	Has a Level 3 service management framework qualification and knowledge of lifecycle or capability elements of ITIL.		
10328	1119	13	Has a Level 3 Service Management Framework qualification and knowledge of lifecycle and / or capability elements of ITIL.		
10336	1119	13	Has a Level 3 Service Management Framework Qualification and knowledge of lifecycle and / or capability elements of ITIL.		
10286	1119	14	Has a level 3 service management framework qualification.		
10300	1119	14	Has a Level 3 Service Management Framework Qualification.		
10339	1119	14	Has a Level 3 Service Management Framework qualification.		
10342	1119	14	Has expert certificate in service management framework qualification.		
10355	1119	14	Has a Level 3 service management framework qualification.		
10191	1120	11	Can interpret and apply understanding across a complex area. Has the ability to start influencing policy and process, business architecture and legal and political implications.		
10186	1120	12	Able to challenge and lead changes to policy and processes to support business outcomes, business architecture and legal and political implications.		
10197	1120	13	Can interpret and apply understanding of policy and process, business architecture, and legal and political implications in order to assist the development of technical solutions or controls.		
10117	1121	11	Able to understand trends and practices within the broader organisation and how these will impact their work. Able to look for deeper underlying problems and opportunities. Can anticipate problems before they occur and identify the impact of changes to policy.		
10113	1121	12	Able to understand trends and practices outside their organisation and how these will impact their work. Can anticipate changing policy.		
10123	1121	13	Able to understand trends and practices outside their team and how these will impact their work. Able to understand how their work fits into the broader strategy and historical context. Capable of considering the patterns and interactions on a larger scale.		
10129	1121	14	Able to understand how their work supports the team and identify the wider influences and how they apply. Able to keep an open mind and understand the broader context.		
10427	1122	11	Understands and can help teams apply a range of techniques to analyse data and provide insight. Is proactive and can present compelling findings that inform wider decisions. Applies innovative approaches to resolve problems.		
10432	1122	12	Understands, teaches and supervises a wide range of analysis techniques. Can help organisations create and learn from strategic insights. Able to apply innovative approaches to resolve problems.		
10450	1122	13	Understands and can work with colleagues to apply core techniques for analysis and providing insight. Presents clear insights that colleagues can understand and use.		
10008	1123	11	Able to collaborate with user researchers and can sell or represent users internally. Understands the difference between user needs and desires of the user. Able to champion user research to focus on all users. Can prioritise and defines approaches to understand the user story, guiding others in doing so. Can offer recommendations on the best tools and methods to be used.		
10016	1123	11	Able to collaborate with user researchers and can sell and represent users internally. Understands the difference between user needs and desires of the user. Able to champion user research to focus on all users. Can prioritise and defines  approaches to understand the user story, guiding others in doing so. Can offer recommendations on the best tools and methods to be used.		
10097	1123	11	Able to collaborate with user researchers and can sell or represent users internally. Understands the difference between user needs and desires of the user. Able to champion user research to focus on totality of all users. Can prioritise and defines approaches to understand the user story, guiding others in doing so. Can offer recommendations on the best tools and methods to be used.		
